misc/trtexec_log.txt
[11/25/2021-09:32:47] [V] [TRT] *************** Autotuning format combination: Float(1,112,12544,37632) -> Float(1,112,12544,225792) ***************
[11/25/2021-09:32:47] [V] [TRT] StatefulPartitionedCall/sequential/sequential/conv2d/BiasAdd + StatefulPartitionedCall/sequential/sequential/activation/Relu (scudnn) Set Tactic Name: volta_scudnn_128x128_relu_medium_nn_v1
[11/25/2021-09:32:47] [V] [TRT] StatefulPartitionedCall/sequential/sequential/conv2d/BiasAdd + StatefulPartitionedCall/sequential/sequential/activation/Relu (scudnn_winograd) Set Tactic Name: volta_scudnn_winograd_128x128_ldg1_ldg4_relu_tile148t_nt_v1
[11/25/2021-09:32:47] [V] [TRT] StatefulPartitionedCall/sequential/sequential/conv2d/BiasAdd + StatefulPartitionedCall/sequential/sequential/activation/Relu (scudnn) Set Tactic Name: volta_scudnn_128x64_relu_xregs_large_nn_v1
[11/25/2021-09:32:47] [V] [TRT] StatefulPartitionedCall/sequential/sequential/conv2d/BiasAdd + StatefulPartitionedCall/sequential/sequential/activation/Relu (scudnn) Set Tactic Name: volta_scudnn_128x128_relu_small_nn_v1
[11/25/2021-09:32:47] [V] [TRT] StatefulPartitionedCall/sequential/sequential/conv2d/BiasAdd + StatefulPartitionedCall/sequential/sequential/activation/Relu (scudnn) Set Tactic Name: volta_scudnn_128x128_relu_xregs_large_nn_v1
[11/25/2021-09:32:47] [V] [TRT] StatefulPartitionedCall/sequential/sequential/conv2d/BiasAdd + StatefulPartitionedCall/sequential/sequential/activation/Relu (scudnn) Set Tactic Name: volta_scudnn_128x64_relu_small_nn_v1
[11/25/2021-09:32:47] [V] [TRT] StatefulPartitionedCall/sequential/sequential/conv2d/BiasAdd + StatefulPartitionedCall/sequential/sequential/activation/Relu (scudnn) Set Tactic Name: volta_scudnn_128x64_relu_medium_nn_v1
[11/25/2021-09:32:47] [V] [TRT] StatefulPartitionedCall/sequential/sequential/conv2d/BiasAdd + StatefulPartitionedCall/sequential/sequential/activation/Relu (scudnn) Set Tactic Name: volta_scudnn_128x32_relu_medium_nn_v1
[11/25/2021-09:32:47] [V] [TRT] StatefulPartitionedCall/sequential/sequential/conv2d/BiasAdd + StatefulPartitionedCall/sequential/sequential/activation/Relu (scudnn) Set Tactic Name: volta_scudnn_128x32_relu_small_nn_v1
[11/25/2021-09:32:47] [V] [TRT] --------------- Timing Runner: StatefulPartitionedCall/sequential/sequential/conv2d/BiasAdd + StatefulPartitionedCall/sequential/sequential/activation/Relu (FusedConvActConvolution)
[11/25/2021-09:32:47] [V] [TRT] Tactic: 524287 time 0.045008
[11/25/2021-09:32:47] [V] [TRT] Tactic: 1966079 time 0.048072
[11/25/2021-09:32:47] [V] [TRT] Tactic: 2031615 time 0.04824
[11/25/2021-09:32:47] [V] [TRT] Tactic: 4390911 time 0.050796
[11/25/2021-09:32:47] [V] [TRT] Tactic: 5963775 time 0.04596
[11/25/2021-09:32:48] [V] [TRT] Tactic: 6881279 time 0.047336
[11/25/2021-09:32:48] [V] [TRT] Tactic: 8585215 time 0.047208
[11/25/2021-09:32:48] [V] [TRT] Tactic: 8978431 time 0.04634
[11/25/2021-09:32:48] [V] [TRT] Tactic: 9502719 time 0.0509
[11/25/2021-09:32:48] [V] [TRT] Tactic: 10092543 time 0.050476
[11/25/2021-09:32:48] [V] [TRT] Tactic: 10289151 time 0.047588
[11/25/2021-09:32:48] [V] [TRT] Fastest Tactic: 524287 Time: 0.045008
[11/25/2021-09:32:48] [V] [TRT] --------------- Timing Runner: StatefulPartitionedCall/sequential/sequential/conv2d/BiasAdd + StatefulPartitionedCall/sequential/sequential/activation/Relu (CaskConvolution)
[11/25/2021-09:32:48] [V] [TRT] StatefulPartitionedCall/sequential/sequential/conv2d/BiasAdd + StatefulPartitionedCall/sequential/sequential/activation/Relu (scudnn) Set Tactic Name: volta_scudnn_128x128_relu_medium_nn_v1
[11/25/2021-09:32:48] [V] [TRT] Tactic: 1825138533642645384 time 0.063424
[11/25/2021-09:32:48] [V] [TRT] StatefulPartitionedCall/sequential/sequential/conv2d/BiasAdd + StatefulPartitionedCall/sequential/sequential/activation/Relu (scudnn_winograd) Set Tactic Name: volta_scudnn_winograd_128x128_ldg1_ldg4_relu_tile148t_nt_v1
[11/25/2021-09:32:48] [V] [TRT] Tactic: 2775507031594384867 time 0.044808
[11/25/2021-09:32:48] [V] [TRT] StatefulPartitionedCall/sequential/sequential/conv2d/BiasAdd + StatefulPartitionedCall/sequential/sequential/activation/Relu (scudnn) Set Tactic Name: volta_scudnn_128x64_relu_xregs_large_nn_v1
[11/25/2021-09:32:48] [V] [TRT] Tactic: 2842488832350522458 time 0.042448
[11/25/2021-09:32:48] [V] [TRT] StatefulPartitionedCall/sequential/sequential/conv2d/BiasAdd + StatefulPartitionedCall/sequential/sequential/activation/Relu (scudnn) Set Tactic Name: volta_scudnn_128x128_relu_small_nn_v1
[11/25/2021-09:32:48] [V] [TRT] Tactic: 3915320020053085238 time 0.062924
[11/25/2021-09:32:48] [V] [TRT] StatefulPartitionedCall/sequential/sequential/conv2d/BiasAdd + StatefulPartitionedCall/sequential/sequential/activation/Relu (scudnn) Set Tactic Name: volta_scudnn_128x128_relu_xregs_large_nn_v1
[11/25/2021-09:32:48] [V] [TRT] Tactic: 6448355332020552203 time 0.082132
[11/25/2021-09:32:48] [V] [TRT] StatefulPartitionedCall/sequential/sequential/conv2d/BiasAdd + StatefulPartitionedCall/sequential/sequential/activation/Relu (scudnn) Set Tactic Name: volta_scudnn_128x64_relu_small_nn_v1
[11/25/2021-09:32:48] [V] [TRT] Tactic: 6808617066150061604 time 0.0381
[11/25/2021-09:32:48] [V] [TRT] StatefulPartitionedCall/sequential/sequential/conv2d/BiasAdd + StatefulPartitionedCall/sequential/sequential/activation/Relu (scudnn) Set Tactic Name: volta_scudnn_128x64_relu_medium_nn_v1
[11/25/2021-09:32:48] [V] [TRT] Tactic: -8060443123034038864 time 0.038272
[11/25/2021-09:32:48] [V] [TRT] StatefulPartitionedCall/sequential/sequential/conv2d/BiasAdd + StatefulPartitionedCall/sequential/sequential/activation/Relu (scudnn) Set Tactic Name: volta_scudnn_128x32_relu_medium_nn_v1
[11/25/2021-09:32:48] [V] [TRT] Tactic: -4420849921117327522 time 0.024248
[11/25/2021-09:32:48] [V] [TRT] StatefulPartitionedCall/sequential/sequential/conv2d/BiasAdd + StatefulPartitionedCall/sequential/sequential/activation/Relu (scudnn) Set Tactic Name: volta_scudnn_128x32_relu_small_nn_v1
[11/25/2021-09:32:48] [V] [TRT] Tactic: -3946921629105938337 time 0.025416
[11/25/2021-09:32:48] [V] [TRT] Fastest Tactic: -4420849921117327522 Time: 0.024248
[11/25/2021-09:32:48] [V] [TRT] --------------- Timing Runner: StatefulPartitionedCall/sequential/sequential/conv2d/BiasAdd + StatefulPartitionedCall/sequential/sequential/activation/Relu (CudaConvolution)
[11/25/2021-09:32:48] [V] [TRT] Tactic: 0 time 0.04446
[11/25/2021-09:32:48] [V] [TRT] Tactic: 1 time 0.04628
[11/25/2021-09:32:48] [V] [TRT] Tactic: 2 time 0.053684
[11/25/2021-09:32:48] [V] [TRT] Tactic: 5 time 0.475404
[11/25/2021-09:32:48] [V] [TRT] Tactic: 6 time 0.064028
[11/25/2021-09:32:48] [V] [TRT] Tactic: 56 time 0.043676
[11/25/2021-09:32:48] [V] [TRT] Tactic: 57 time 0.043448
[11/25/2021-09:32:48] [V] [TRT] Tactic: 58 time 0.053652
[11/25/2021-09:32:48] [V] [TRT] Tactic: 61 time 0.47634
[11/25/2021-09:32:48] [V] [TRT] Tactic: 62 time 0.064256
[11/25/2021-09:32:48] [V] [TRT] Fastest Tactic: 57 Time: 0.043448
[11/25/2021-09:32:48] [V] [TRT] --------------- Timing Runner: StatefulPartitionedCall/sequential/sequential/conv2d/BiasAdd + StatefulPartitionedCall/sequential/sequential/activation/Relu (CudaDepthwiseConvolution)
[11/25/2021-09:32:48] [V] [TRT] CudaDepthwiseConvolution has no valid tactics for this config, skipping
[11/25/2021-09:32:48] [V] [TRT] --------------- Timing Runner: StatefulPartitionedCall/sequential/sequential/conv2d/BiasAdd + StatefulPartitionedCall/sequential/sequential/activation/Relu (CublasConvolution)
[11/25/2021-09:32:48] [V] [TRT] CublasConvolution has no valid tactics for this config, skipping
[11/25/2021-09:32:48] [V] [TRT] >>>>>>>>>>>>>>> Chose Runner Type: CaskConvolution Tactic: -4420849921117327522
[11/25/2021-09:32:48] [V] [TRT] StatefulPartitionedCall/sequential/sequential/conv2d/BiasAdd + StatefulPartitionedCall/sequential/sequential/activation/Relu (scudnn) Set Tactic Name: volta_scudnn_128x32_relu_medium_nn_v1
[11/25/2021-09:32:48] [V] [TRT] 
[11/25/2021-09:32:48] [V] [TRT] StatefulPartitionedCall/sequential/sequential/conv2d/BiasAdd + StatefulPartitionedCall/sequential/sequential/activation/Relu (scudnn) Set Tactic Name: volta_scudnn_128x128_relu_medium_nn_v1
[11/25/2021-09:32:48] [V] [TRT] StatefulPartitionedCall/sequential/sequential/conv2d/BiasAdd + StatefulPartitionedCall/sequential/sequential/activation/Relu (scudnn_winograd) Set Tactic Name: volta_scudnn_winograd_128x128_ldg1_ldg4_relu_tile148t_nt_v1
[11/25/2021-09:32:48] [V] [TRT] StatefulPartitionedCall/sequential/sequential/conv2d/BiasAdd + StatefulPartitionedCall/sequential/sequential/activation/Relu (scudnn) Set Tactic Name: volta_scudnn_128x64_relu_xregs_large_nn_v1
[11/25/2021-09:32:48] [V] [TRT] StatefulPartitionedCall/sequential/sequential/conv2d/BiasAdd + StatefulPartitionedCall/sequential/sequential/activation/Relu (scudnn) Set Tactic Name: volta_scudnn_128x128_relu_small_nn_v1
[11/25/2021-09:32:48] [V] [TRT] StatefulPartitionedCall/sequential/sequential/conv2d/BiasAdd + StatefulPartitionedCall/sequential/sequential/activation/Relu (scudnn) Set Tactic Name: volta_scudnn_128x128_relu_xregs_large_nn_v1
[11/25/2021-09:32:48] [V] [TRT] StatefulPartitionedCall/sequential/sequential/conv2d/BiasAdd + StatefulPartitionedCall/sequential/sequential/activation/Relu (scudnn) Set Tactic Name: volta_scudnn_128x64_relu_small_nn_v1
[11/25/2021-09:32:48] [V] [TRT] StatefulPartitionedCall/sequential/sequential/conv2d/BiasAdd + StatefulPartitionedCall/sequential/sequential/activation/Relu (scudnn) Set Tactic Name: volta_scudnn_128x64_relu_medium_nn_v1
[11/25/2021-09:32:48] [V] [TRT] StatefulPartitionedCall/sequential/sequential/conv2d/BiasAdd + StatefulPartitionedCall/sequential/sequential/activation/Relu (scudnn) Set Tactic Name: volta_scudnn_128x32_relu_medium_nn_v1
[11/25/2021-09:32:48] [V] [TRT] StatefulPartitionedCall/sequential/sequential/conv2d/BiasAdd + StatefulPartitionedCall/sequential/sequential/activation/Relu (scudnn) Set Tactic Name: volta_scudnn_128x32_relu_small_nn_v1
[11/25/2021-09:32:48] [V] [TRT] StatefulPartitionedCall/sequential/sequential/conv2d/BiasAdd + StatefulPartitionedCall/sequential/sequential/activation/Relu (scudnn) Set Tactic Name: volta_scudnn_128x32_relu_medium_nn_v1
[11/25/2021-09:32:48] [V] [TRT] *************** Autotuning format combination: Float(3,336,1,37632) -> Float(18,2016,1,225792) ***************
[11/25/2021-09:32:48] [V] [TRT] --------------- Timing Runner: StatefulPartitionedCall/sequential/sequential/conv2d/BiasAdd + StatefulPartitionedCall/sequential/sequential/activation/Relu (FusedConvActConvolution)
[11/25/2021-09:32:48] [V] [TRT] FusedConvActConvolution has no valid tactics for this config, skipping
[11/25/2021-09:32:48] [V] [TRT] --------------- Timing Runner: StatefulPartitionedCall/sequential/sequential/conv2d/BiasAdd + StatefulPartitionedCall/sequential/sequential/activation/Relu (CaskConvolution)
[11/25/2021-09:32:48] [V] [TRT] CaskConvolution has no valid tactics for this config, skipping
[11/25/2021-09:32:48] [V] [TRT] --------------- Timing Runner: StatefulPartitionedCall/sequential/sequential/conv2d/BiasAdd + StatefulPartitionedCall/sequential/sequential/activation/Relu (CudaConvolution)
[11/25/2021-09:32:48] [V] [TRT] CudaConvolution has no valid tactics for this config, skipping
[11/25/2021-09:32:48] [V] [TRT] --------------- Timing Runner: StatefulPartitionedCall/sequential/sequential/conv2d/BiasAdd + StatefulPartitionedCall/sequential/sequential/activation/Relu (CudaDepthwiseConvolution)
[11/25/2021-09:32:48] [V] [TRT] CudaDepthwiseConvolution has no valid tactics for this config, skipping
[11/25/2021-09:32:48] [V] [TRT] --------------- Timing Runner: StatefulPartitionedCall/sequential/sequential/conv2d/BiasAdd + StatefulPartitionedCall/sequential/sequential/activation/Relu (CublasConvolution)
[11/25/2021-09:32:48] [V] [TRT] CublasConvolution has no valid tactics for this config, skipping
[11/25/2021-09:32:48] [V] [TRT] --------------- Timing Runner: <reformat> (Reformat)
[11/25/2021-09:32:48] [V] [TRT] Tactic: 1002 time 0.020472
[11/25/2021-09:32:48] [V] [TRT] Tactic: 0 time 0.017188
[11/25/2021-09:32:48] [V] [TRT] Fastest Tactic: 0 Time: 0.017188
[11/25/2021-09:32:48] [V] [TRT] --------------- Timing Runner: <reformat> (Reformat)
[11/25/2021-09:32:48] [V] [TRT] Tactic: 1002 time 0.01938
[11/25/2021-09:32:48] [V] [TRT] Tactic: 0 time 0.018504
[11/25/2021-09:32:48] [V] [TRT] Fastest Tactic: 0 Time: 0.018504
[11/25/2021-09:32:48] [V] [TRT] *************** Autotuning format combination: Float(1,112,12544,225792) -> Float(1,112,12544,225792) ***************
[11/25/2021-09:32:48] [V] [TRT] --------------- Timing Runner: StatefulPartitionedCall/sequential/sequential/batch_normalization/FusedBatchNormV3 (Scale)
[11/25/2021-09:32:48] [V] [TRT] Tactic: 0 time 0.011768
[11/25/2021-09:32:48] [V] [TRT] Fastest Tactic: 0 Time: 0.011768
[11/25/2021-09:32:48] [V] [TRT] *************** Autotuning format combination: Float(18,2016,1,225792) -> Float(18,2016,1,225792) ***************
[11/25/2021-09:32:48] [V] [TRT] --------------- Timing Runner: StatefulPartitionedCall/sequential/sequential/batch_normalization/FusedBatchNormV3 (Scale)
[11/25/2021-09:32:48] [V] [TRT] Scale has no valid tactics for this config, skipping
[11/25/2021-09:32:48] [V] [TRT] *************** Autotuning format combination: Float(1,112,12544,225792) -> Float(1,112,12544,225792) ***************
[11/25/2021-09:32:48] [V] [TRT] StatefulPartitionedCall/sequential/sequential/conv2d_1/BiasAdd + StatefulPartitionedCall/sequential/sequential/activation_1/Relu (scudnn) Set Tactic Name: volta_scudnn_128x128_relu_medium_nn_v1
[11/25/2021-09:32:48] [V] [TRT] StatefulPartitionedCall/sequential/sequential/conv2d_1/BiasAdd + StatefulPartitionedCall/sequential/sequential/activation_1/Relu (scudnn_winograd) Set Tactic Name: volta_scudnn_winograd_128x128_ldg1_ldg4_relu_tile148t_nt_v1
[11/25/2021-09:32:48] [V] [TRT] StatefulPartitionedCall/sequential/sequential/conv2d_1/BiasAdd + StatefulPartitionedCall/sequential/sequential/activation_1/Relu (scudnn) Set Tactic Name: volta_scudnn_128x64_relu_xregs_large_nn_v1
[11/25/2021-09:32:48] [V] [TRT] StatefulPartitionedCall/sequential/sequential/conv2d_1/BiasAdd + StatefulPartitionedCall/sequential/sequential/activation_1/Relu (scudnn) Set Tactic Name: volta_scudnn_128x128_relu_small_nn_v1
[11/25/2021-09:32:48] [V] [TRT] StatefulPartitionedCall/sequential/sequential/conv2d_1/BiasAdd + StatefulPartitionedCall/sequential/sequential/activation_1/Relu (scudnn) Set Tactic Name: volta_scudnn_128x128_relu_xregs_large_nn_v1
[11/25/2021-09:32:48] [V] [TRT] StatefulPartitionedCall/sequential/sequential/conv2d_1/BiasAdd + StatefulPartitionedCall/sequential/sequential/activation_1/Relu (scudnn) Set Tactic Name: volta_scudnn_128x64_relu_small_nn_v1
[11/25/2021-09:32:48] [V] [TRT] StatefulPartitionedCall/sequential/sequential/conv2d_1/BiasAdd + StatefulPartitionedCall/sequential/sequential/activation_1/Relu (scudnn) Set Tactic Name: volta_scudnn_128x64_relu_medium_nn_v1
[11/25/2021-09:32:48] [V] [TRT] StatefulPartitionedCall/sequential/sequential/conv2d_1/BiasAdd + StatefulPartitionedCall/sequential/sequential/activation_1/Relu (scudnn) Set Tactic Name: volta_scudnn_128x32_relu_medium_nn_v1
[11/25/2021-09:32:48] [V] [TRT] StatefulPartitionedCall/sequential/sequential/conv2d_1/BiasAdd + StatefulPartitionedCall/sequential/sequential/activation_1/Relu (scudnn) Set Tactic Name: volta_scudnn_128x32_relu_small_nn_v1
[11/25/2021-09:32:48] [V] [TRT] --------------- Timing Runner: StatefulPartitionedCall/sequential/sequential/conv2d_1/BiasAdd + StatefulPartitionedCall/sequential/sequential/activation_1/Relu (FusedConvActConvolution)
[11/25/2021-09:32:48] [V] [TRT] Tactic: 524287 time 0.067688
[11/25/2021-09:32:48] [V] [TRT] Tactic: 720895 time 0.105328
[11/25/2021-09:32:48] [V] [TRT] Tactic: 1048575 time 0.065656
[11/25/2021-09:32:48] [V] [TRT] Tactic: 1966079 time 0.115908
[11/25/2021-09:32:48] [V] [TRT] Tactic: 2031615 time 0.112924
[11/25/2021-09:32:48] [V] [TRT] Tactic: 2752511 time 0.108964
[11/25/2021-09:32:48] [V] [TRT] Tactic: 4390911 time 0.126876
[11/25/2021-09:32:48] [V] [TRT] Tactic: 5046271 time 0.061092
[11/25/2021-09:32:48] [V] [TRT] Tactic: 5963775 time 0.105424
[11/25/2021-09:32:48] [V] [TRT] Tactic: 6160383 time 0.066156
[11/25/2021-09:32:48] [V] [TRT] Tactic: 6488063 time 0.067936
[11/25/2021-09:32:48] [V] [TRT] Tactic: 6881279 time 0.112652
[11/25/2021-09:32:48] [V] [TRT] Tactic: 7995391 time 0.099048
[11/25/2021-09:32:48] [V] [TRT] Tactic: 8585215 time 0.076368
[11/25/2021-09:32:48] [V] [TRT] Tactic: 8978431 time 0.105712
[11/25/2021-09:32:48] [V] [TRT] Tactic: 9502719 time 0.12752
[11/25/2021-09:32:48] [V] [TRT] Tactic: 10027007 time 0.064708
[11/25/2021-09:32:48] [V] [TRT] Tactic: 10092543 time 0.126292
[11/25/2021-09:32:48] [V] [TRT] Tactic: 10289151 time 0.115804
[11/25/2021-09:32:48] [V] [TRT] Fastest Tactic: 5046271 Time: 0.061092
[11/25/2021-09:32:48] [V] [TRT] --------------- Timing Runner: StatefulPartitionedCall/sequential/sequential/conv2d_1/BiasAdd + StatefulPartitionedCall/sequential/sequential/activation_1/Relu (CaskConvolution)
[11/25/2021-09:32:48] [V] [TRT] StatefulPartitionedCall/sequential/sequential/conv2d_1/BiasAdd + StatefulPartitionedCall/sequential/sequential/activation_1/Relu (scudnn) Set Tactic Name: volta_scudnn_128x128_relu_medium_nn_v1
[11/25/2021-09:32:48] [V] [TRT] Tactic: 1825138533642645384 time 0.208136
[11/25/2021-09:32:48] [V] [TRT] StatefulPartitionedCall/sequential/sequential/conv2d_1/BiasAdd + StatefulPartitionedCall/sequential/sequential/activation_1/Relu (scudnn_winograd) Set Tactic Name: volta_scudnn_winograd_128x128_ldg1_ldg4_relu_tile148t_nt_v1
[11/25/2021-09:32:48] [V] [TRT] Tactic: 2775507031594384867 time 0.069588
[11/25/2021-09:32:48] [V] [TRT] StatefulPartitionedCall/sequential/sequential/conv2d_1/BiasAdd + StatefulPartitionedCall/sequential/sequential/activation_1/Relu (scudnn) Set Tactic Name: volta_scudnn_128x64_relu_xregs_large_nn_v1
[11/25/2021-09:32:48] [V] [TRT] Tactic: 2842488832350522458 time 0.11596
[11/25/2021-09:32:48] [V] [TRT] StatefulPartitionedCall/sequential/sequential/conv2d_1/BiasAdd + StatefulPartitionedCall/sequential/sequential/activation_1/Relu (scudnn) Set Tactic Name: volta_scudnn_128x128_relu_small_nn_v1
[11/25/2021-09:32:48] [V] [TRT] Tactic: 3915320020053085238 time 0.207368
[11/25/2021-09:32:48] [V] [TRT] StatefulPartitionedCall/sequential/sequential/conv2d_1/BiasAdd + StatefulPartitionedCall/sequential/sequential/activation_1/Relu (scudnn) Set Tactic Name: volta_scudnn_128x128_relu_xregs_large_nn_v1
[11/25/2021-09:32:48] [V] [TRT] Tactic: 6448355332020552203 time 0.231256
[11/25/2021-09:32:48] [V] [TRT] StatefulPartitionedCall/sequential/sequential/conv2d_1/BiasAdd + StatefulPartitionedCall/sequential/sequential/activation_1/Relu (scudnn) Set Tactic Name: volta_scudnn_128x64_relu_small_nn_v1
[11/25/2021-09:32:48] [V] [TRT] Tactic: 6808617066150061604 time 0.116384
[11/25/2021-09:32:48] [V] [TRT] StatefulPartitionedCall/sequential/sequential/conv2d_1/BiasAdd + StatefulPartitionedCall/sequential/sequential/activation_1/Relu (scudnn) Set Tactic Name: volta_scudnn_128x64_relu_medium_nn_v1
[11/25/2021-09:32:48] [V] [TRT] Tactic: -8060443123034038864 time 0.118692
[11/25/2021-09:32:48] [V] [TRT] StatefulPartitionedCall/sequential/sequential/conv2d_1/BiasAdd + StatefulPartitionedCall/sequential/sequential/activation_1/Relu (scudnn) Set Tactic Name: volta_scudnn_128x32_relu_medium_nn_v1
[11/25/2021-09:32:48] [V] [TRT] Tactic: -4420849921117327522 time 0.07184
[11/25/2021-09:32:48] [V] [TRT] StatefulPartitionedCall/sequential/sequential/conv2d_1/BiasAdd + StatefulPartitionedCall/sequential/sequential/activation_1/Relu (scudnn) Set Tactic Name: volta_scudnn_128x32_relu_small_nn_v1
[11/25/2021-09:32:48] [V] [TRT] Tactic: -3946921629105938337 time 0.070348
[11/25/2021-09:32:48] [V] [TRT] Fastest Tactic: 2775507031594384867 Time: 0.069588
[11/25/2021-09:32:48] [V] [TRT] --------------- Timing Runner: StatefulPartitionedCall/sequential/sequential/conv2d_1/BiasAdd + StatefulPartitionedCall/sequential/sequential/activation_1/Relu (CudaConvolution)
[11/25/2021-09:32:48] [V] [TRT] Tactic: 0 time 0.118648
[11/25/2021-09:32:48] [V] [TRT] Tactic: 1 time 0.118632
[11/25/2021-09:32:48] [V] [TRT] Tactic: 2 time 0.176508
[11/25/2021-09:32:49] [V] [TRT] Tactic: 5 time 0.603104
[11/25/2021-09:32:49] [V] [TRT] Tactic: 6 time 0.088764
[11/25/2021-09:32:49] [V] [TRT] Tactic: 56 time 0.118672
[11/25/2021-09:32:49] [V] [TRT] Tactic: 57 time 0.11814
[11/25/2021-09:32:49] [V] [TRT] Tactic: 58 time 0.176852
[11/25/2021-09:32:49] [V] [TRT] Tactic: 61 time 0.603116
[11/25/2021-09:32:49] [V] [TRT] Tactic: 62 time 0.0887
[11/25/2021-09:32:49] [V] [TRT] Fastest Tactic: 62 Time: 0.0887
[11/25/2021-09:32:49] [V] [TRT] --------------- Timing Runner: StatefulPartitionedCall/sequential/sequential/conv2d_1/BiasAdd + StatefulPartitionedCall/sequential/sequential/activation_1/Relu (CudaDepthwiseConvolution)
[11/25/2021-09:32:49] [V] [TRT] CudaDepthwiseConvolution has no valid tactics for this config, skipping
[11/25/2021-09:32:49] [V] [TRT] --------------- Timing Runner: StatefulPartitionedCall/sequential/sequential/conv2d_1/BiasAdd + StatefulPartitionedCall/sequential/sequential/activation_1/Relu (CublasConvolution)
[11/25/2021-09:32:49] [V] [TRT] CublasConvolution has no valid tactics for this config, skipping
[11/25/2021-09:32:49] [V] [TRT] >>>>>>>>>>>>>>> Chose Runner Type: FusedConvActConvolution Tactic: 5046271
[11/25/2021-09:32:49] [V] [TRT] 
[11/25/2021-09:32:49] [V] [TRT] *************** Autotuning format combination: Float(18,2016,1,225792) -> Float(18,2016,1,225792) ***************
[11/25/2021-09:32:49] [V] [TRT] --------------- Timing Runner: StatefulPartitionedCall/sequential/sequential/conv2d_1/BiasAdd + StatefulPartitionedCall/sequential/sequential/activation_1/Relu (FusedConvActConvolution)
[11/25/2021-09:32:49] [V] [TRT] FusedConvActConvolution has no valid tactics for this config, skipping
[11/25/2021-09:32:49] [V] [TRT] --------------- Timing Runner: StatefulPartitionedCall/sequential/sequential/conv2d_1/BiasAdd + StatefulPartitionedCall/sequential/sequential/activation_1/Relu (CaskConvolution)
[11/25/2021-09:32:49] [V] [TRT] CaskConvolution has no valid tactics for this config, skipping
[11/25/2021-09:32:49] [V] [TRT] --------------- Timing Runner: StatefulPartitionedCall/sequential/sequential/conv2d_1/BiasAdd + StatefulPartitionedCall/sequential/sequential/activation_1/Relu (CudaConvolution)
[11/25/2021-09:32:49] [V] [TRT] CudaConvolution has no valid tactics for this config, skipping
[11/25/2021-09:32:49] [V] [TRT] --------------- Timing Runner: StatefulPartitionedCall/sequential/sequential/conv2d_1/BiasAdd + StatefulPartitionedCall/sequential/sequential/activation_1/Relu (CudaDepthwiseConvolution)
[11/25/2021-09:32:49] [V] [TRT] CudaDepthwiseConvolution has no valid tactics for this config, skipping
[11/25/2021-09:32:49] [V] [TRT] --------------- Timing Runner: StatefulPartitionedCall/sequential/sequential/conv2d_1/BiasAdd + StatefulPartitionedCall/sequential/sequential/activation_1/Relu (CublasConvolution)
[11/25/2021-09:32:49] [V] [TRT] CublasConvolution has no valid tactics for this config, skipping
[11/25/2021-09:32:49] [V] [TRT] *************** Autotuning format combination: Float(1,112,12544,225792) -> Float(1,56,3136,56448) ***************
[11/25/2021-09:32:49] [V] [TRT] --------------- Timing Runner: StatefulPartitionedCall/sequential/sequential/max_pooling2d/MaxPool (Pooling)
[11/25/2021-09:32:49] [V] [TRT] Tactic: -1 time 0.010808
[11/25/2021-09:32:49] [V] [TRT] Fastest Tactic: -1 Time: 0.010808
[11/25/2021-09:32:49] [V] [TRT] --------------- Timing Runner: StatefulPartitionedCall/sequential/sequential/max_pooling2d/MaxPool (TiledPooling)
[11/25/2021-09:32:49] [V] [TRT] Tactic: 5505281 time 0.014896
[11/25/2021-09:32:49] [V] [TRT] Tactic: 5570817 time 0.011228
[11/25/2021-09:32:49] [V] [TRT] Tactic: 5636353 time 0.010224
[11/25/2021-09:32:49] [V] [TRT] Tactic: 5701889 time 0.010416
[11/25/2021-09:32:49] [V] [TRT] Tactic: 5767425 time 0.010156
[11/25/2021-09:32:49] [V] [TRT] Tactic: 5832961 time 0.009668
[11/25/2021-09:32:49] [V] [TRT] Tactic: 5898497 time 0.010268
[11/25/2021-09:32:49] [V] [TRT] Tactic: 5964033 time 0.010644
[11/25/2021-09:32:49] [V] [TRT] Tactic: 6029569 time 0.014784
[11/25/2021-09:32:49] [V] [TRT] Tactic: 6095105 time 0.010948
[11/25/2021-09:32:49] [V] [TRT] Tactic: 6160641 time 0.009908
[11/25/2021-09:32:49] [V] [TRT] Tactic: 6226177 time 0.009756
[11/25/2021-09:32:49] [V] [TRT] Tactic: 6291713 time 0.0094
[11/25/2021-09:32:49] [V] [TRT] Tactic: 6357249 time 0.00972
[11/25/2021-09:32:49] [V] [TRT] Tactic: 6422785 time 0.00982
[11/25/2021-09:32:49] [V] [TRT] Tactic: 6488321 time 0.010408
[11/25/2021-09:32:49] [V] [TRT] Fastest Tactic: 6291713 Time: 0.0094
[11/25/2021-09:32:49] [V] [TRT] >>>>>>>>>>>>>>> Chose Runner Type: TiledPooling Tactic: 6291713
[11/25/2021-09:32:49] [V] [TRT] 
[11/25/2021-09:32:49] [V] [TRT] --------------- Timing Runner: <reformat> (Reformat)
[11/25/2021-09:32:49] [V] [TRT] Tactic: 1002 time 0.010608
[11/25/2021-09:32:49] [V] [TRT] Tactic: 0 time 0.009804
[11/25/2021-09:32:49] [V] [TRT] Fastest Tactic: 0 Time: 0.009804
[11/25/2021-09:32:49] [V] [TRT] --------------- Timing Runner: <reformat> (Reformat)
[11/25/2021-09:32:49] [V] [TRT] Tactic: 1002 time 0.010452
[11/25/2021-09:32:49] [V] [TRT] Tactic: 0 time 0.00988
[11/25/2021-09:32:49] [V] [TRT] Fastest Tactic: 0 Time: 0.00988
[11/25/2021-09:32:49] [V] [TRT] --------------- Timing Runner: <reformat> (Reformat)
[11/25/2021-09:32:49] [V] [TRT] Tactic: 1002 time 0.010408
[11/25/2021-09:32:49] [V] [TRT] Tactic: 0 time 0.009832
[11/25/2021-09:32:49] [V] [TRT] Fastest Tactic: 0 Time: 0.009832
[11/25/2021-09:32:49] [V] [TRT] *************** Autotuning format combination: Float(1,56,3136,56448) -> Float(1,56,3136,56448) ***************
[11/25/2021-09:32:49] [V] [TRT] --------------- Timing Runner: StatefulPartitionedCall/sequential/sequential/batch_normalization_1/FusedBatchNormV3 (Scale)
[11/25/2021-09:32:49] [V] [TRT] Tactic: 0 time 0.008008
[11/25/2021-09:32:49] [V] [TRT] Fastest Tactic: 0 Time: 0.008008
[11/25/2021-09:32:49] [V] [TRT] *************** Autotuning format combination: Float(18,1008,1,56448) -> Float(18,1008,1,56448) ***************
[11/25/2021-09:32:49] [V] [TRT] --------------- Timing Runner: StatefulPartitionedCall/sequential/sequential/batch_normalization_1/FusedBatchNormV3 (Scale)
[11/25/2021-09:32:49] [V] [TRT] Scale has no valid tactics for this config, skipping
[11/25/2021-09:32:49] [V] [TRT] *************** Autotuning format combination: Float(1,56,3136,56448) -> Float(1,56,3136,112896) ***************
[11/25/2021-09:32:49] [V] [TRT] StatefulPartitionedCall/sequential/sequential/conv2d_2/BiasAdd + StatefulPartitionedCall/sequential/sequential/activation_2/Relu (scudnn) Set Tactic Name: volta_scudnn_128x128_relu_medium_nn_v1
[11/25/2021-09:32:49] [V] [TRT] StatefulPartitionedCall/sequential/sequential/conv2d_2/BiasAdd + StatefulPartitionedCall/sequential/sequential/activation_2/Relu (scudnn_winograd) Set Tactic Name: volta_scudnn_winograd_128x128_ldg1_ldg4_relu_tile148t_nt_v1
[11/25/2021-09:32:49] [V] [TRT] StatefulPartitionedCall/sequential/sequential/conv2d_2/BiasAdd + StatefulPartitionedCall/sequential/sequential/activation_2/Relu (scudnn) Set Tactic Name: volta_scudnn_128x64_relu_xregs_large_nn_v1
[11/25/2021-09:32:49] [V] [TRT] StatefulPartitionedCall/sequential/sequential/conv2d_2/BiasAdd + StatefulPartitionedCall/sequential/sequential/activation_2/Relu (scudnn) Set Tactic Name: volta_scudnn_128x128_relu_small_nn_v1
[11/25/2021-09:32:49] [V] [TRT] StatefulPartitionedCall/sequential/sequential/conv2d_2/BiasAdd + StatefulPartitionedCall/sequential/sequential/activation_2/Relu (scudnn) Set Tactic Name: volta_scudnn_128x128_relu_xregs_large_nn_v1
[11/25/2021-09:32:49] [V] [TRT] StatefulPartitionedCall/sequential/sequential/conv2d_2/BiasAdd + StatefulPartitionedCall/sequential/sequential/activation_2/Relu (scudnn) Set Tactic Name: volta_scudnn_128x64_relu_small_nn_v1
[11/25/2021-09:32:49] [V] [TRT] StatefulPartitionedCall/sequential/sequential/conv2d_2/BiasAdd + StatefulPartitionedCall/sequential/sequential/activation_2/Relu (scudnn) Set Tactic Name: volta_scudnn_128x64_relu_medium_nn_v1
[11/25/2021-09:32:49] [V] [TRT] StatefulPartitionedCall/sequential/sequential/conv2d_2/BiasAdd + StatefulPartitionedCall/sequential/sequential/activation_2/Relu (scudnn) Set Tactic Name: volta_scudnn_128x32_relu_medium_nn_v1
[11/25/2021-09:32:49] [V] [TRT] StatefulPartitionedCall/sequential/sequential/conv2d_2/BiasAdd + StatefulPartitionedCall/sequential/sequential/activation_2/Relu (scudnn) Set Tactic Name: volta_scudnn_128x32_relu_small_nn_v1
[11/25/2021-09:32:49] [V] [TRT] --------------- Timing Runner: StatefulPartitionedCall/sequential/sequential/conv2d_2/BiasAdd + StatefulPartitionedCall/sequential/sequential/activation_2/Relu (FusedConvActConvolution)
[11/25/2021-09:32:49] [V] [TRT] Tactic: 524287 time 0.04616
[11/25/2021-09:32:49] [V] [TRT] Tactic: 720895 time 0.04552
[11/25/2021-09:32:49] [V] [TRT] Tactic: 1048575 time 0.0552
[11/25/2021-09:32:49] [V] [TRT] Tactic: 1966079 time 0.054224
[11/25/2021-09:32:49] [V] [TRT] Tactic: 2031615 time 0.060004
[11/25/2021-09:32:49] [V] [TRT] Tactic: 2752511 time 0.047388
[11/25/2021-09:32:50] [V] [TRT] Tactic: 2883583 time 0.079464
[11/25/2021-09:32:50] [V] [TRT] Tactic: 3473407 time 0.07146
[11/25/2021-09:32:50] [V] [TRT] Tactic: 3735551 time 0.061928
[11/25/2021-09:32:50] [V] [TRT] Tactic: 4390911 time 0.057164
[11/25/2021-09:32:50] [V] [TRT] Tactic: 5046271 time 0.047636
[11/25/2021-09:32:50] [V] [TRT] Tactic: 5963775 time 0.052104
[11/25/2021-09:32:50] [V] [TRT] Tactic: 6160383 time 0.044044
[11/25/2021-09:32:50] [V] [TRT] Tactic: 6488063 time 0.048344
[11/25/2021-09:32:50] [V] [TRT] Tactic: 6881279 time 0.05436
[11/25/2021-09:32:50] [V] [TRT] Tactic: 7995391 time 0.045164
[11/25/2021-09:32:50] [V] [TRT] Tactic: 8585215 time 0.050952
[11/25/2021-09:32:50] [V] [TRT] Tactic: 8978431 time 0.051504
[11/25/2021-09:32:50] [V] [TRT] Tactic: 9502719 time 0.056164
[11/25/2021-09:32:50] [V] [TRT] Tactic: 9830399 time 0.057768
[11/25/2021-09:32:50] [V] [TRT] Tactic: 10027007 time 0.045008
[11/25/2021-09:32:50] [V] [TRT] Tactic: 10092543 time 0.058052
[11/25/2021-09:32:50] [V] [TRT] Tactic: 10289151 time 0.055032
[11/25/2021-09:32:50] [V] [TRT] Fastest Tactic: 6160383 Time: 0.044044
[11/25/2021-09:32:50] [V] [TRT] --------------- Timing Runner: StatefulPartitionedCall/sequential/sequential/conv2d_2/BiasAdd + StatefulPartitionedCall/sequential/sequential/activation_2/Relu (CaskConvolution)
[11/25/2021-09:32:50] [V] [TRT] StatefulPartitionedCall/sequential/sequential/conv2d_2/BiasAdd + StatefulPartitionedCall/sequential/sequential/activation_2/Relu (scudnn) Set Tactic Name: volta_scudnn_128x128_relu_medium_nn_v1
[11/25/2021-09:32:50] [V] [TRT] Tactic: 1825138533642645384 time 0.063068
[11/25/2021-09:32:50] [V] [TRT] StatefulPartitionedCall/sequential/sequential/conv2d_2/BiasAdd + StatefulPartitionedCall/sequential/sequential/activation_2/Relu (scudnn_winograd) Set Tactic Name: volta_scudnn_winograd_128x128_ldg1_ldg4_relu_tile148t_nt_v1
[11/25/2021-09:32:50] [V] [TRT] Tactic: 2775507031594384867 time 0.038508
[11/25/2021-09:32:50] [V] [TRT] StatefulPartitionedCall/sequential/sequential/conv2d_2/BiasAdd + StatefulPartitionedCall/sequential/sequential/activation_2/Relu (scudnn) Set Tactic Name: volta_scudnn_128x64_relu_xregs_large_nn_v1
[11/25/2021-09:32:50] [V] [TRT] Tactic: 2842488832350522458 time 0.044432
[11/25/2021-09:32:50] [V] [TRT] StatefulPartitionedCall/sequential/sequential/conv2d_2/BiasAdd + StatefulPartitionedCall/sequential/sequential/activation_2/Relu (scudnn) Set Tactic Name: volta_scudnn_128x128_relu_small_nn_v1
[11/25/2021-09:32:50] [V] [TRT] Tactic: 3915320020053085238 time 0.061708
[11/25/2021-09:32:50] [V] [TRT] StatefulPartitionedCall/sequential/sequential/conv2d_2/BiasAdd + StatefulPartitionedCall/sequential/sequential/activation_2/Relu (scudnn) Set Tactic Name: volta_scudnn_128x128_relu_xregs_large_nn_v1
[11/25/2021-09:32:50] [V] [TRT] Tactic: 6448355332020552203 time 0.063304
[11/25/2021-09:32:50] [V] [TRT] StatefulPartitionedCall/sequential/sequential/conv2d_2/BiasAdd + StatefulPartitionedCall/sequential/sequential/activation_2/Relu (scudnn) Set Tactic Name: volta_scudnn_128x64_relu_small_nn_v1
[11/25/2021-09:32:50] [V] [TRT] Tactic: 6808617066150061604 time 0.0424
[11/25/2021-09:32:50] [V] [TRT] StatefulPartitionedCall/sequential/sequential/conv2d_2/BiasAdd + StatefulPartitionedCall/sequential/sequential/activation_2/Relu (scudnn) Set Tactic Name: volta_scudnn_128x64_relu_medium_nn_v1
[11/25/2021-09:32:50] [V] [TRT] Tactic: -8060443123034038864 time 0.045196
[11/25/2021-09:32:50] [V] [TRT] StatefulPartitionedCall/sequential/sequential/conv2d_2/BiasAdd + StatefulPartitionedCall/sequential/sequential/activation_2/Relu (scudnn) Set Tactic Name: volta_scudnn_128x32_relu_medium_nn_v1
[11/25/2021-09:32:50] [V] [TRT] Tactic: -4420849921117327522 time 0.045196
[11/25/2021-09:32:50] [V] [TRT] StatefulPartitionedCall/sequential/sequential/conv2d_2/BiasAdd + StatefulPartitionedCall/sequential/sequential/activation_2/Relu (scudnn) Set Tactic Name: volta_scudnn_128x32_relu_small_nn_v1
[11/25/2021-09:32:50] [V] [TRT] Tactic: -3946921629105938337 time 0.066084
[11/25/2021-09:32:50] [V] [TRT] Fastest Tactic: 2775507031594384867 Time: 0.038508
[11/25/2021-09:32:50] [V] [TRT] --------------- Timing Runner: StatefulPartitionedCall/sequential/sequential/conv2d_2/BiasAdd + StatefulPartitionedCall/sequential/sequential/activation_2/Relu (CudaConvolution)
[11/25/2021-09:32:50] [V] [TRT] Tactic: 0 time 0.072284
[11/25/2021-09:32:50] [V] [TRT] Tactic: 1 time 0.057784
[11/25/2021-09:32:50] [V] [TRT] Tactic: 2 time 0.11318
[11/25/2021-09:32:50] [V] [TRT] Tactic: 5 time 0.240008
[11/25/2021-09:32:50] [V] [TRT] Tactic: 6 time 0.05364
[11/25/2021-09:32:50] [V] [TRT] Tactic: 56 time 0.07238
[11/25/2021-09:32:50] [V] [TRT] Tactic: 57 time 0.0576
[11/25/2021-09:32:50] [V] [TRT] Tactic: 58 time 0.113592
[11/25/2021-09:32:50] [V] [TRT] Tactic: 61 time 0.241176
[11/25/2021-09:32:50] [V] [TRT] Tactic: 62 time 0.053772
[11/25/2021-09:32:50] [V] [TRT] Fastest Tactic: 6 Time: 0.05364
[11/25/2021-09:32:50] [V] [TRT] --------------- Timing Runner: StatefulPartitionedCall/sequential/sequential/conv2d_2/BiasAdd + StatefulPartitionedCall/sequential/sequential/activation_2/Relu (CudaDepthwiseConvolution)
[11/25/2021-09:32:50] [V] [TRT] CudaDepthwiseConvolution has no valid tactics for this config, skipping
[11/25/2021-09:32:50] [V] [TRT] --------------- Timing Runner: StatefulPartitionedCall/sequential/sequential/conv2d_2/BiasAdd + StatefulPartitionedCall/sequential/sequential/activation_2/Relu (CublasConvolution)
[11/25/2021-09:32:50] [V] [TRT] CublasConvolution has no valid tactics for this config, skipping
[11/25/2021-09:32:50] [V] [TRT] >>>>>>>>>>>>>>> Chose Runner Type: CaskConvolution Tactic: 2775507031594384867
[11/25/2021-09:32:50] [V] [TRT] StatefulPartitionedCall/sequential/sequential/conv2d_2/BiasAdd + StatefulPartitionedCall/sequential/sequential/activation_2/Relu (scudnn_winograd) Set Tactic Name: volta_scudnn_winograd_128x128_ldg1_ldg4_relu_tile148t_nt_v1
[11/25/2021-09:32:50] [V] [TRT] 
[11/25/2021-09:32:50] [V] [TRT] StatefulPartitionedCall/sequential/sequential/conv2d_2/BiasAdd + StatefulPartitionedCall/sequential/sequential/activation_2/Relu (scudnn) Set Tactic Name: volta_scudnn_128x128_relu_medium_nn_v1
[11/25/2021-09:32:50] [V] [TRT] StatefulPartitionedCall/sequential/sequential/conv2d_2/BiasAdd + StatefulPartitionedCall/sequential/sequential/activation_2/Relu (scudnn_winograd) Set Tactic Name: volta_scudnn_winograd_128x128_ldg1_ldg4_relu_tile148t_nt_v1
[11/25/2021-09:32:50] [V] [TRT] StatefulPartitionedCall/sequential/sequential/conv2d_2/BiasAdd + StatefulPartitionedCall/sequential/sequential/activation_2/Relu (scudnn) Set Tactic Name: volta_scudnn_128x64_relu_xregs_large_nn_v1
[11/25/2021-09:32:50] [V] [TRT] StatefulPartitionedCall/sequential/sequential/conv2d_2/BiasAdd + StatefulPartitionedCall/sequential/sequential/activation_2/Relu (scudnn) Set Tactic Name: volta_scudnn_128x128_relu_small_nn_v1
[11/25/2021-09:32:50] [V] [TRT] StatefulPartitionedCall/sequential/sequential/conv2d_2/BiasAdd + StatefulPartitionedCall/sequential/sequential/activation_2/Relu (scudnn) Set Tactic Name: volta_scudnn_128x128_relu_xregs_large_nn_v1
[11/25/2021-09:32:50] [V] [TRT] StatefulPartitionedCall/sequential/sequential/conv2d_2/BiasAdd + StatefulPartitionedCall/sequential/sequential/activation_2/Relu (scudnn) Set Tactic Name: volta_scudnn_128x64_relu_small_nn_v1
[11/25/2021-09:32:50] [V] [TRT] StatefulPartitionedCall/sequential/sequential/conv2d_2/BiasAdd + StatefulPartitionedCall/sequential/sequential/activation_2/Relu (scudnn) Set Tactic Name: volta_scudnn_128x64_relu_medium_nn_v1
[11/25/2021-09:32:50] [V] [TRT] StatefulPartitionedCall/sequential/sequential/conv2d_2/BiasAdd + StatefulPartitionedCall/sequential/sequential/activation_2/Relu (scudnn) Set Tactic Name: volta_scudnn_128x32_relu_medium_nn_v1
[11/25/2021-09:32:50] [V] [TRT] StatefulPartitionedCall/sequential/sequential/conv2d_2/BiasAdd + StatefulPartitionedCall/sequential/sequential/activation_2/Relu (scudnn) Set Tactic Name: volta_scudnn_128x32_relu_small_nn_v1
[11/25/2021-09:32:50] [V] [TRT] StatefulPartitionedCall/sequential/sequential/conv2d_2/BiasAdd + StatefulPartitionedCall/sequential/sequential/activation_2/Relu (scudnn_winograd) Set Tactic Name: volta_scudnn_winograd_128x128_ldg1_ldg4_relu_tile148t_nt_v1
[11/25/2021-09:32:50] [V] [TRT] *************** Autotuning format combination: Float(18,1008,1,56448) -> Float(36,2016,1,112896) ***************
[11/25/2021-09:32:50] [V] [TRT] StatefulPartitionedCall/sequential/sequential/conv2d_2/BiasAdd + StatefulPartitionedCall/sequential/sequential/activation_2/Relu (scudnn) Set Tactic Name: volta_scudnn_128x128_relu_exp_medium_nhwc_tn_v1
[11/25/2021-09:32:50] [V] [TRT] StatefulPartitionedCall/sequential/sequential/conv2d_2/BiasAdd + StatefulPartitionedCall/sequential/sequential/activation_2/Relu (scudnn) Set Tactic Name: volta_scudnn_128x128_relu_exp_small_nhwc_tn_v1
[11/25/2021-09:32:50] [V] [TRT] StatefulPartitionedCall/sequential/sequential/conv2d_2/BiasAdd + StatefulPartitionedCall/sequential/sequential/activation_2/Relu (scudnn) Set Tactic Name: volta_scudnn_128x128_relu_exp_large_nhwc_tn_v1
[11/25/2021-09:32:50] [V] [TRT] --------------- Timing Runner: StatefulPartitionedCall/sequential/sequential/conv2d_2/BiasAdd + StatefulPartitionedCall/sequential/sequential/activation_2/Relu (FusedConvActConvolution)
[11/25/2021-09:32:50] [V] [TRT] FusedConvActConvolution has no valid tactics for this config, skipping
[11/25/2021-09:32:50] [V] [TRT] --------------- Timing Runner: StatefulPartitionedCall/sequential/sequential/conv2d_2/BiasAdd + StatefulPartitionedCall/sequential/sequential/activation_2/Relu (CaskConvolution)
[11/25/2021-09:32:50] [V] [TRT] StatefulPartitionedCall/sequential/sequential/conv2d_2/BiasAdd + StatefulPartitionedCall/sequential/sequential/activation_2/Relu (scudnn) Set Tactic Name: volta_scudnn_128x128_relu_exp_medium_nhwc_tn_v1
[11/25/2021-09:32:50] [V] [TRT] Tactic: 861694390046228376 time 0.075056
[11/25/2021-09:32:50] [V] [TRT] StatefulPartitionedCall/sequential/sequential/conv2d_2/BiasAdd + StatefulPartitionedCall/sequential/sequential/activation_2/Relu (scudnn) Set Tactic Name: volta_scudnn_128x128_relu_exp_small_nhwc_tn_v1
[11/25/2021-09:32:50] [V] [TRT] Tactic: 5821621277990374316 time 0.074564
[11/25/2021-09:32:50] [V] [TRT] StatefulPartitionedCall/sequential/sequential/conv2d_2/BiasAdd + StatefulPartitionedCall/sequential/sequential/activation_2/Relu (scudnn) Set Tactic Name: volta_scudnn_128x128_relu_exp_large_nhwc_tn_v1
[11/25/2021-09:32:50] [V] [TRT] Tactic: -3853827649136781465 time 0.076052
[11/25/2021-09:32:50] [V] [TRT] Fastest Tactic: 5821621277990374316 Time: 0.074564
[11/25/2021-09:32:50] [V] [TRT] --------------- Timing Runner: StatefulPartitionedCall/sequential/sequential/conv2d_2/BiasAdd + StatefulPartitionedCall/sequential/sequential/activation_2/Relu (CudaConvolution)
[11/25/2021-09:32:50] [V] [TRT] CudaConvolution has no valid tactics for this config, skipping
[11/25/2021-09:32:50] [V] [TRT] --------------- Timing Runner: StatefulPartitionedCall/sequential/sequential/conv2d_2/BiasAdd + StatefulPartitionedCall/sequential/sequential/activation_2/Relu (CudaDepthwiseConvolution)
[11/25/2021-09:32:50] [V] [TRT] CudaDepthwiseConvolution has no valid tactics for this config, skipping
[11/25/2021-09:32:50] [V] [TRT] --------------- Timing Runner: StatefulPartitionedCall/sequential/sequential/conv2d_2/BiasAdd + StatefulPartitionedCall/sequential/sequential/activation_2/Relu (CublasConvolution)
[11/25/2021-09:32:50] [V] [TRT] CublasConvolution has no valid tactics for this config, skipping
[11/25/2021-09:32:50] [V] [TRT] >>>>>>>>>>>>>>> Chose Runner Type: CaskConvolution Tactic: 5821621277990374316
[11/25/2021-09:32:50] [V] [TRT] StatefulPartitionedCall/sequential/sequential/conv2d_2/BiasAdd + StatefulPartitionedCall/sequential/sequential/activation_2/Relu (scudnn) Set Tactic Name: volta_scudnn_128x128_relu_exp_small_nhwc_tn_v1
[11/25/2021-09:32:50] [V] [TRT] 
[11/25/2021-09:32:50] [V] [TRT] StatefulPartitionedCall/sequential/sequential/conv2d_2/BiasAdd + StatefulPartitionedCall/sequential/sequential/activation_2/Relu (scudnn) Set Tactic Name: volta_scudnn_128x128_relu_exp_medium_nhwc_tn_v1
[11/25/2021-09:32:50] [V] [TRT] StatefulPartitionedCall/sequential/sequential/conv2d_2/BiasAdd + StatefulPartitionedCall/sequential/sequential/activation_2/Relu (scudnn) Set Tactic Name: volta_scudnn_128x128_relu_exp_small_nhwc_tn_v1
[11/25/2021-09:32:50] [V] [TRT] StatefulPartitionedCall/sequential/sequential/conv2d_2/BiasAdd + StatefulPartitionedCall/sequential/sequential/activation_2/Relu (scudnn) Set Tactic Name: volta_scudnn_128x128_relu_exp_large_nhwc_tn_v1
[11/25/2021-09:32:50] [V] [TRT] StatefulPartitionedCall/sequential/sequential/conv2d_2/BiasAdd + StatefulPartitionedCall/sequential/sequential/activation_2/Relu (scudnn) Set Tactic Name: volta_scudnn_128x128_relu_exp_small_nhwc_tn_v1
[11/25/2021-09:32:50] [V] [TRT] --------------- Timing Runner: <reformat> (Reformat)
[11/25/2021-09:32:50] [V] [TRT] Tactic: 1002 time 0.01442
[11/25/2021-09:32:50] [V] [TRT] Tactic: 0 time 0.015144
[11/25/2021-09:32:50] [V] [TRT] Fastest Tactic: 1002 Time: 0.01442
[11/25/2021-09:32:50] [V] [TRT] --------------- Timing Runner: <reformat> (Reformat)
[11/25/2021-09:32:50] [V] [TRT] Tactic: 1002 time 0.014168
[11/25/2021-09:32:50] [V] [TRT] Tactic: 0 time 0.01348
[11/25/2021-09:32:50] [V] [TRT] Fastest Tactic: 0 Time: 0.01348
[11/25/2021-09:32:50] [V] [TRT] *************** Autotuning format combination: Float(1,56,3136,112896) -> Float(1,56,3136,112896) ***************
[11/25/2021-09:32:50] [V] [TRT] --------------- Timing Runner: StatefulPartitionedCall/sequential/sequential/batch_normalization_2/FusedBatchNormV3 (Scale)
[11/25/2021-09:32:50] [V] [TRT] Tactic: 0 time 0.008872
[11/25/2021-09:32:50] [V] [TRT] Fastest Tactic: 0 Time: 0.008872
[11/25/2021-09:32:50] [V] [TRT] *************** Autotuning format combination: Float(36,2016,1,112896) -> Float(36,2016,1,112896) ***************
[11/25/2021-09:32:50] [V] [TRT] --------------- Timing Runner: StatefulPartitionedCall/sequential/sequential/batch_normalization_2/FusedBatchNormV3 (Scale)
[11/25/2021-09:32:50] [V] [TRT] Scale has no valid tactics for this config, skipping
[11/25/2021-09:32:50] [V] [TRT] *************** Autotuning format combination: Float(1,56,3136,112896) -> Float(1,56,3136,112896) ***************
[11/25/2021-09:32:50] [V] [TRT] StatefulPartitionedCall/sequential/sequential/conv2d_3/BiasAdd + StatefulPartitionedCall/sequential/sequential/activation_3/Relu (scudnn) Set Tactic Name: volta_scudnn_128x128_relu_medium_nn_v1
[11/25/2021-09:32:50] [V] [TRT] StatefulPartitionedCall/sequential/sequential/conv2d_3/BiasAdd + StatefulPartitionedCall/sequential/sequential/activation_3/Relu (scudnn_winograd) Set Tactic Name: volta_scudnn_winograd_128x128_ldg1_ldg4_relu_tile148t_nt_v1
[11/25/2021-09:32:50] [V] [TRT] StatefulPartitionedCall/sequential/sequential/conv2d_3/BiasAdd + StatefulPartitionedCall/sequential/sequential/activation_3/Relu (scudnn) Set Tactic Name: volta_scudnn_128x64_relu_xregs_large_nn_v1
[11/25/2021-09:32:50] [V] [TRT] StatefulPartitionedCall/sequential/sequential/conv2d_3/BiasAdd + StatefulPartitionedCall/sequential/sequential/activation_3/Relu (scudnn) Set Tactic Name: volta_scudnn_128x128_relu_small_nn_v1
[11/25/2021-09:32:50] [V] [TRT] StatefulPartitionedCall/sequential/sequential/conv2d_3/BiasAdd + StatefulPartitionedCall/sequential/sequential/activation_3/Relu (scudnn) Set Tactic Name: volta_scudnn_128x128_relu_xregs_large_nn_v1
[11/25/2021-09:32:50] [V] [TRT] StatefulPartitionedCall/sequential/sequential/conv2d_3/BiasAdd + StatefulPartitionedCall/sequential/sequential/activation_3/Relu (scudnn) Set Tactic Name: volta_scudnn_128x64_relu_small_nn_v1
[11/25/2021-09:32:50] [V] [TRT] StatefulPartitionedCall/sequential/sequential/conv2d_3/BiasAdd + StatefulPartitionedCall/sequential/sequential/activation_3/Relu (scudnn) Set Tactic Name: volta_scudnn_128x64_relu_medium_nn_v1
[11/25/2021-09:32:50] [V] [TRT] StatefulPartitionedCall/sequential/sequential/conv2d_3/BiasAdd + StatefulPartitionedCall/sequential/sequential/activation_3/Relu (scudnn) Set Tactic Name: volta_scudnn_128x32_relu_medium_nn_v1
[11/25/2021-09:32:50] [V] [TRT] StatefulPartitionedCall/sequential/sequential/conv2d_3/BiasAdd + StatefulPartitionedCall/sequential/sequential/activation_3/Relu (scudnn) Set Tactic Name: volta_scudnn_128x32_relu_small_nn_v1
[11/25/2021-09:32:50] [V] [TRT] --------------- Timing Runner: StatefulPartitionedCall/sequential/sequential/conv2d_3/BiasAdd + StatefulPartitionedCall/sequential/sequential/activation_3/Relu (FusedConvActConvolution)
[11/25/2021-09:32:50] [V] [TRT] Tactic: 524287 time 0.070848
[11/25/2021-09:32:50] [V] [TRT] Tactic: 720895 time 0.068
[11/25/2021-09:32:50] [V] [TRT] Tactic: 983039 time 0.057492
[11/25/2021-09:32:50] [V] [TRT] Tactic: 1048575 time 0.082472
[11/25/2021-09:32:50] [V] [TRT] Tactic: 1703935 time 0.062704
[11/25/2021-09:32:50] [V] [TRT] Tactic: 1966079 time 0.082992
[11/25/2021-09:32:50] [V] [TRT] Tactic: 2031615 time 0.099868
[11/25/2021-09:32:50] [V] [TRT] Tactic: 2228223 time 0.07724
[11/25/2021-09:32:50] [V] [TRT] Tactic: 2752511 time 0.073608
[11/25/2021-09:32:50] [V] [TRT] Tactic: 2818047 time 0.116184
[11/25/2021-09:32:50] [V] [TRT] Tactic: 2883583 time 0.140276
[11/25/2021-09:32:50] [V] [TRT] Tactic: 3014655 time 0.061096
[11/25/2021-09:32:50] [V] [TRT] Tactic: 3145727 time 0.067604
[11/25/2021-09:32:50] [V] [TRT] Tactic: 3473407 time 0.104436
[11/25/2021-09:32:50] [V] [TRT] Tactic: 3604479 time 0.060528
[11/25/2021-09:32:50] [V] [TRT] Tactic: 3735551 time 0.106112
[11/25/2021-09:32:50] [V] [TRT] Tactic: 4390911 time 0.088364
[11/25/2021-09:32:50] [V] [TRT] Tactic: 5046271 time 0.068432
[11/25/2021-09:32:50] [V] [TRT] Tactic: 5963775 time 0.077196
[11/25/2021-09:32:50] [V] [TRT] Tactic: 6160383 time 0.06702
[11/25/2021-09:32:50] [V] [TRT] Tactic: 6488063 time 0.077012
[11/25/2021-09:32:50] [V] [TRT] Tactic: 6881279 time 0.089932
[11/25/2021-09:32:50] [V] [TRT] Tactic: 7995391 time 0.07016
[11/25/2021-09:32:50] [V] [TRT] Tactic: 8585215 time 0.080204
[11/25/2021-09:32:50] [V] [TRT] Tactic: 8978431 time 0.077264
[11/25/2021-09:32:50] [V] [TRT] Tactic: 9043967 time 0.0637
[11/25/2021-09:32:50] [V] [TRT] Tactic: 9175039 time 0.060124
[11/25/2021-09:32:50] [V] [TRT] Tactic: 9502719 time 0.087456
[11/25/2021-09:32:50] [V] [TRT] Tactic: 9830399 time 0.099236
[11/25/2021-09:32:50] [V] [TRT] Tactic: 10027007 time 0.072492
[11/25/2021-09:32:50] [V] [TRT] Tactic: 10092543 time 0.088288
[11/25/2021-09:32:50] [V] [TRT] Tactic: 10289151 time 0.083216
[11/25/2021-09:32:50] [V] [TRT] Tactic: 10485759 time 0.061492
[11/25/2021-09:32:50] [V] [TRT] Tactic: 10813439 time 0.0634
[11/25/2021-09:32:50] [V] [TRT] Fastest Tactic: 983039 Time: 0.057492
[11/25/2021-09:32:50] [V] [TRT] --------------- Timing Runner: StatefulPartitionedCall/sequential/sequential/conv2d_3/BiasAdd + StatefulPartitionedCall/sequential/sequential/activation_3/Relu (CaskConvolution)
[11/25/2021-09:32:50] [V] [TRT] StatefulPartitionedCall/sequential/sequential/conv2d_3/BiasAdd + StatefulPartitionedCall/sequential/sequential/activation_3/Relu (scudnn) Set Tactic Name: volta_scudnn_128x128_relu_medium_nn_v1
[11/25/2021-09:32:50] [V] [TRT] Tactic: 1825138533642645384 time 0.107556
[11/25/2021-09:32:50] [V] [TRT] StatefulPartitionedCall/sequential/sequential/conv2d_3/BiasAdd + StatefulPartitionedCall/sequential/sequential/activation_3/Relu (scudnn_winograd) Set Tactic Name: volta_scudnn_winograd_128x128_ldg1_ldg4_relu_tile148t_nt_v1
[11/25/2021-09:32:50] [V] [TRT] Tactic: 2775507031594384867 time 0.051232
[11/25/2021-09:32:50] [V] [TRT] StatefulPartitionedCall/sequential/sequential/conv2d_3/BiasAdd + StatefulPartitionedCall/sequential/sequential/activation_3/Relu (scudnn) Set Tactic Name: volta_scudnn_128x64_relu_xregs_large_nn_v1
[11/25/2021-09:32:50] [V] [TRT] Tactic: 2842488832350522458 time 0.07272
[11/25/2021-09:32:50] [V] [TRT] StatefulPartitionedCall/sequential/sequential/conv2d_3/BiasAdd + StatefulPartitionedCall/sequential/sequential/activation_3/Relu (scudnn) Set Tactic Name: volta_scudnn_128x128_relu_small_nn_v1
[11/25/2021-09:32:50] [V] [TRT] Tactic: 3915320020053085238 time 0.1054
[11/25/2021-09:32:50] [V] [TRT] StatefulPartitionedCall/sequential/sequential/conv2d_3/BiasAdd + StatefulPartitionedCall/sequential/sequential/activation_3/Relu (scudnn) Set Tactic Name: volta_scudnn_128x128_relu_xregs_large_nn_v1
[11/25/2021-09:32:50] [V] [TRT] Tactic: 6448355332020552203 time 0.10794
[11/25/2021-09:32:50] [V] [TRT] StatefulPartitionedCall/sequential/sequential/conv2d_3/BiasAdd + StatefulPartitionedCall/sequential/sequential/activation_3/Relu (scudnn) Set Tactic Name: volta_scudnn_128x64_relu_small_nn_v1
[11/25/2021-09:32:50] [V] [TRT] Tactic: 6808617066150061604 time 0.068904
[11/25/2021-09:32:50] [V] [TRT] StatefulPartitionedCall/sequential/sequential/conv2d_3/BiasAdd + StatefulPartitionedCall/sequential/sequential/activation_3/Relu (scudnn) Set Tactic Name: volta_scudnn_128x64_relu_medium_nn_v1
[11/25/2021-09:32:50] [V] [TRT] Tactic: -8060443123034038864 time 0.074228
[11/25/2021-09:32:50] [V] [TRT] StatefulPartitionedCall/sequential/sequential/conv2d_3/BiasAdd + StatefulPartitionedCall/sequential/sequential/activation_3/Relu (scudnn) Set Tactic Name: volta_scudnn_128x32_relu_medium_nn_v1
[11/25/2021-09:32:50] [V] [TRT] Tactic: -4420849921117327522 time 0.076576
[11/25/2021-09:32:50] [V] [TRT] StatefulPartitionedCall/sequential/sequential/conv2d_3/BiasAdd + StatefulPartitionedCall/sequential/sequential/activation_3/Relu (scudnn) Set Tactic Name: volta_scudnn_128x32_relu_small_nn_v1
[11/25/2021-09:32:50] [V] [TRT] Tactic: -3946921629105938337 time 0.115728
[11/25/2021-09:32:50] [V] [TRT] Fastest Tactic: 2775507031594384867 Time: 0.051232
[11/25/2021-09:32:50] [V] [TRT] --------------- Timing Runner: StatefulPartitionedCall/sequential/sequential/conv2d_3/BiasAdd + StatefulPartitionedCall/sequential/sequential/activation_3/Relu (CudaConvolution)
[11/25/2021-09:32:50] [V] [TRT] Tactic: 0 time 0.118596
[11/25/2021-09:32:50] [V] [TRT] Tactic: 1 time 0.083268
[11/25/2021-09:32:50] [V] [TRT] Tactic: 2 time 0.196728
[11/25/2021-09:32:50] [V] [TRT] Tactic: 5 time 0.287416
[11/25/2021-09:32:50] [V] [TRT] Tactic: 6 time 0.066232
[11/25/2021-09:32:50] [V] [TRT] Tactic: 56 time 0.118388
[11/25/2021-09:32:50] [V] [TRT] Tactic: 57 time 0.093856
[11/25/2021-09:32:50] [V] [TRT] Tactic: 58 time 0.197228
[11/25/2021-09:32:50] [V] [TRT] Tactic: 61 time 0.285948
[11/25/2021-09:32:50] [V] [TRT] Tactic: 62 time 0.066208
[11/25/2021-09:32:50] [V] [TRT] Fastest Tactic: 62 Time: 0.066208
[11/25/2021-09:32:50] [V] [TRT] --------------- Timing Runner: StatefulPartitionedCall/sequential/sequential/conv2d_3/BiasAdd + StatefulPartitionedCall/sequential/sequential/activation_3/Relu (CudaDepthwiseConvolution)
[11/25/2021-09:32:50] [V] [TRT] CudaDepthwiseConvolution has no valid tactics for this config, skipping
[11/25/2021-09:32:50] [V] [TRT] --------------- Timing Runner: StatefulPartitionedCall/sequential/sequential/conv2d_3/BiasAdd + StatefulPartitionedCall/sequential/sequential/activation_3/Relu (CublasConvolution)
[11/25/2021-09:32:50] [V] [TRT] CublasConvolution has no valid tactics for this config, skipping
[11/25/2021-09:32:50] [V] [TRT] >>>>>>>>>>>>>>> Chose Runner Type: CaskConvolution Tactic: 2775507031594384867
[11/25/2021-09:32:50] [V] [TRT] StatefulPartitionedCall/sequential/sequential/conv2d_3/BiasAdd + StatefulPartitionedCall/sequential/sequential/activation_3/Relu (scudnn_winograd) Set Tactic Name: volta_scudnn_winograd_128x128_ldg1_ldg4_relu_tile148t_nt_v1
[11/25/2021-09:32:50] [V] [TRT] 
[11/25/2021-09:32:50] [V] [TRT] StatefulPartitionedCall/sequential/sequential/conv2d_3/BiasAdd + StatefulPartitionedCall/sequential/sequential/activation_3/Relu (scudnn) Set Tactic Name: volta_scudnn_128x128_relu_medium_nn_v1
[11/25/2021-09:32:50] [V] [TRT] StatefulPartitionedCall/sequential/sequential/conv2d_3/BiasAdd + StatefulPartitionedCall/sequential/sequential/activation_3/Relu (scudnn_winograd) Set Tactic Name: volta_scudnn_winograd_128x128_ldg1_ldg4_relu_tile148t_nt_v1
[11/25/2021-09:32:50] [V] [TRT] StatefulPartitionedCall/sequential/sequential/conv2d_3/BiasAdd + StatefulPartitionedCall/sequential/sequential/activation_3/Relu (scudnn) Set Tactic Name: volta_scudnn_128x64_relu_xregs_large_nn_v1
[11/25/2021-09:32:50] [V] [TRT] StatefulPartitionedCall/sequential/sequential/conv2d_3/BiasAdd + StatefulPartitionedCall/sequential/sequential/activation_3/Relu (scudnn) Set Tactic Name: volta_scudnn_128x128_relu_small_nn_v1
[11/25/2021-09:32:50] [V] [TRT] StatefulPartitionedCall/sequential/sequential/conv2d_3/BiasAdd + StatefulPartitionedCall/sequential/sequential/activation_3/Relu (scudnn) Set Tactic Name: volta_scudnn_128x128_relu_xregs_large_nn_v1
[11/25/2021-09:32:50] [V] [TRT] StatefulPartitionedCall/sequential/sequential/conv2d_3/BiasAdd + StatefulPartitionedCall/sequential/sequential/activation_3/Relu (scudnn) Set Tactic Name: volta_scudnn_128x64_relu_small_nn_v1
[11/25/2021-09:32:50] [V] [TRT] StatefulPartitionedCall/sequential/sequential/conv2d_3/BiasAdd + StatefulPartitionedCall/sequential/sequential/activation_3/Relu (scudnn) Set Tactic Name: volta_scudnn_128x64_relu_medium_nn_v1
[11/25/2021-09:32:50] [V] [TRT] StatefulPartitionedCall/sequential/sequential/conv2d_3/BiasAdd + StatefulPartitionedCall/sequential/sequential/activation_3/Relu (scudnn) Set Tactic Name: volta_scudnn_128x32_relu_medium_nn_v1
[11/25/2021-09:32:50] [V] [TRT] StatefulPartitionedCall/sequential/sequential/conv2d_3/BiasAdd + StatefulPartitionedCall/sequential/sequential/activation_3/Relu (scudnn) Set Tactic Name: volta_scudnn_128x32_relu_small_nn_v1
[11/25/2021-09:32:50] [V] [TRT] StatefulPartitionedCall/sequential/sequential/conv2d_3/BiasAdd + StatefulPartitionedCall/sequential/sequential/activation_3/Relu (scudnn_winograd) Set Tactic Name: volta_scudnn_winograd_128x128_ldg1_ldg4_relu_tile148t_nt_v1
[11/25/2021-09:32:50] [V] [TRT] *************** Autotuning format combination: Float(36,2016,1,112896) -> Float(36,2016,1,112896) ***************
[11/25/2021-09:32:50] [V] [TRT] StatefulPartitionedCall/sequential/sequential/conv2d_3/BiasAdd + StatefulPartitionedCall/sequential/sequential/activation_3/Relu (scudnn) Set Tactic Name: volta_scudnn_128x128_relu_exp_medium_nhwc_tn_v1
[11/25/2021-09:32:50] [V] [TRT] StatefulPartitionedCall/sequential/sequential/conv2d_3/BiasAdd + StatefulPartitionedCall/sequential/sequential/activation_3/Relu (scudnn) Set Tactic Name: volta_scudnn_128x128_ldg4_relu_exp_large_nhwc_tn_v1
[11/25/2021-09:32:50] [V] [TRT] StatefulPartitionedCall/sequential/sequential/conv2d_3/BiasAdd + StatefulPartitionedCall/sequential/sequential/activation_3/Relu (scudnn) Set Tactic Name: volta_scudnn_128x64_sliced1x2_ldg4_relu_exp_small_nhwc_tn_v1
[11/25/2021-09:32:50] [V] [TRT] StatefulPartitionedCall/sequential/sequential/conv2d_3/BiasAdd + StatefulPartitionedCall/sequential/sequential/activation_3/Relu (scudnn) Set Tactic Name: volta_scudnn_128x128_relu_exp_small_nhwc_tn_v1
[11/25/2021-09:32:50] [V] [TRT] StatefulPartitionedCall/sequential/sequential/conv2d_3/BiasAdd + StatefulPartitionedCall/sequential/sequential/activation_3/Relu (scudnn) Set Tactic Name: volta_scudnn_128x32_sliced1x4_ldg4_relu_exp_small_nhwc_tn_v1
[11/25/2021-09:32:50] [V] [TRT] StatefulPartitionedCall/sequential/sequential/conv2d_3/BiasAdd + StatefulPartitionedCall/sequential/sequential/activation_3/Relu (scudnn) Set Tactic Name: volta_scudnn_128x128_ldg4_relu_exp_medium_nhwc_tn_v1
[11/25/2021-09:32:50] [V] [TRT] StatefulPartitionedCall/sequential/sequential/conv2d_3/BiasAdd + StatefulPartitionedCall/sequential/sequential/activation_3/Relu (scudnn) Set Tactic Name: volta_scudnn_128x64_sliced1x2_ldg4_relu_exp_medium_nhwc_tn_v1
[11/25/2021-09:32:50] [V] [TRT] StatefulPartitionedCall/sequential/sequential/conv2d_3/BiasAdd + StatefulPartitionedCall/sequential/sequential/activation_3/Relu (scudnn) Set Tactic Name: volta_scudnn_128x128_ldg4_relu_exp_small_nhwc_tn_v1
[11/25/2021-09:32:50] [V] [TRT] StatefulPartitionedCall/sequential/sequential/conv2d_3/BiasAdd + StatefulPartitionedCall/sequential/sequential/activation_3/Relu (scudnn) Set Tactic Name: volta_scudnn_128x128_relu_exp_large_nhwc_tn_v1
[11/25/2021-09:32:50] [V] [TRT] StatefulPartitionedCall/sequential/sequential/conv2d_3/BiasAdd + StatefulPartitionedCall/sequential/sequential/activation_3/Relu (scudnn) Set Tactic Name: volta_scudnn_128x64_sliced1x2_ldg4_relu_exp_large_nhwc_tn_v1
[11/25/2021-09:32:50] [V] [TRT] StatefulPartitionedCall/sequential/sequential/conv2d_3/BiasAdd + StatefulPartitionedCall/sequential/sequential/activation_3/Relu (scudnn) Set Tactic Name: volta_scudnn_128x32_sliced1x4_ldg4_relu_exp_medium_nhwc_tn_v1
[11/25/2021-09:32:50] [V] [TRT] --------------- Timing Runner: StatefulPartitionedCall/sequential/sequential/conv2d_3/BiasAdd + StatefulPartitionedCall/sequential/sequential/activation_3/Relu (FusedConvActConvolution)
[11/25/2021-09:32:50] [V] [TRT] FusedConvActConvolution has no valid tactics for this config, skipping
[11/25/2021-09:32:50] [V] [TRT] --------------- Timing Runner: StatefulPartitionedCall/sequential/sequential/conv2d_3/BiasAdd + StatefulPartitionedCall/sequential/sequential/activation_3/Relu (CaskConvolution)
[11/25/2021-09:32:50] [V] [TRT] StatefulPartitionedCall/sequential/sequential/conv2d_3/BiasAdd + StatefulPartitionedCall/sequential/sequential/activation_3/Relu (scudnn) Set Tactic Name: volta_scudnn_128x128_relu_exp_medium_nhwc_tn_v1
[11/25/2021-09:32:50] [V] [TRT] Tactic: 861694390046228376 time 0.114672
[11/25/2021-09:32:50] [V] [TRT] StatefulPartitionedCall/sequential/sequential/conv2d_3/BiasAdd + StatefulPartitionedCall/sequential/sequential/activation_3/Relu (scudnn) Set Tactic Name: volta_scudnn_128x128_ldg4_relu_exp_large_nhwc_tn_v1
[11/25/2021-09:32:50] [V] [TRT] Tactic: 1017870653102653567 time 0.114236
[11/25/2021-09:32:50] [V] [TRT] StatefulPartitionedCall/sequential/sequential/conv2d_3/BiasAdd + StatefulPartitionedCall/sequential/sequential/activation_3/Relu (scudnn) Set Tactic Name: volta_scudnn_128x64_sliced1x2_ldg4_relu_exp_small_nhwc_tn_v1
[11/25/2021-09:32:51] [V] [TRT] Tactic: 5258189349241541167 time 0.077328
[11/25/2021-09:32:51] [V] [TRT] StatefulPartitionedCall/sequential/sequential/conv2d_3/BiasAdd + StatefulPartitionedCall/sequential/sequential/activation_3/Relu (scudnn) Set Tactic Name: volta_scudnn_128x128_relu_exp_small_nhwc_tn_v1
[11/25/2021-09:32:51] [V] [TRT] Tactic: 5821621277990374316 time 0.11404
[11/25/2021-09:32:51] [V] [TRT] StatefulPartitionedCall/sequential/sequential/conv2d_3/BiasAdd + StatefulPartitionedCall/sequential/sequential/activation_3/Relu (scudnn) Set Tactic Name: volta_scudnn_128x32_sliced1x4_ldg4_relu_exp_small_nhwc_tn_v1
[11/25/2021-09:32:51] [V] [TRT] Tactic: 5863767799113001648 time 0.112004
[11/25/2021-09:32:51] [V] [TRT] StatefulPartitionedCall/sequential/sequential/conv2d_3/BiasAdd + StatefulPartitionedCall/sequential/sequential/activation_3/Relu (scudnn) Set Tactic Name: volta_scudnn_128x128_ldg4_relu_exp_medium_nhwc_tn_v1
[11/25/2021-09:32:51] [V] [TRT] Tactic: -9147980667639709536 time 0.11352
[11/25/2021-09:32:51] [V] [TRT] StatefulPartitionedCall/sequential/sequential/conv2d_3/BiasAdd + StatefulPartitionedCall/sequential/sequential/activation_3/Relu (scudnn) Set Tactic Name: volta_scudnn_128x64_sliced1x2_ldg4_relu_exp_medium_nhwc_tn_v1
[11/25/2021-09:32:51] [V] [TRT] Tactic: -8850904373104590857 time 0.077532
[11/25/2021-09:32:51] [V] [TRT] StatefulPartitionedCall/sequential/sequential/conv2d_3/BiasAdd + StatefulPartitionedCall/sequential/sequential/activation_3/Relu (scudnn) Set Tactic Name: volta_scudnn_128x128_ldg4_relu_exp_small_nhwc_tn_v1
[11/25/2021-09:32:51] [V] [TRT] Tactic: -7751035352149795660 time 0.113116
[11/25/2021-09:32:51] [V] [TRT] StatefulPartitionedCall/sequential/sequential/conv2d_3/BiasAdd + StatefulPartitionedCall/sequential/sequential/activation_3/Relu (scudnn) Set Tactic Name: volta_scudnn_128x128_relu_exp_large_nhwc_tn_v1
[11/25/2021-09:32:51] [V] [TRT] Tactic: -3853827649136781465 time 0.115288
[11/25/2021-09:32:51] [V] [TRT] StatefulPartitionedCall/sequential/sequential/conv2d_3/BiasAdd + StatefulPartitionedCall/sequential/sequential/activation_3/Relu (scudnn) Set Tactic Name: volta_scudnn_128x64_sliced1x2_ldg4_relu_exp_large_nhwc_tn_v1
[11/25/2021-09:32:51] [V] [TRT] Tactic: -3263369460438823196 time 0.07688
[11/25/2021-09:32:51] [V] [TRT] StatefulPartitionedCall/sequential/sequential/conv2d_3/BiasAdd + StatefulPartitionedCall/sequential/sequential/activation_3/Relu (scudnn) Set Tactic Name: volta_scudnn_128x32_sliced1x4_ldg4_relu_exp_medium_nhwc_tn_v1
[11/25/2021-09:32:51] [V] [TRT] Tactic: -423878181466897819 time 0.112332
[11/25/2021-09:32:51] [V] [TRT] Fastest Tactic: -3263369460438823196 Time: 0.07688
[11/25/2021-09:32:51] [V] [TRT] --------------- Timing Runner: StatefulPartitionedCall/sequential/sequential/conv2d_3/BiasAdd + StatefulPartitionedCall/sequential/sequential/activation_3/Relu (CudaConvolution)
[11/25/2021-09:32:51] [V] [TRT] CudaConvolution has no valid tactics for this config, skipping
[11/25/2021-09:32:51] [V] [TRT] --------------- Timing Runner: StatefulPartitionedCall/sequential/sequential/conv2d_3/BiasAdd + StatefulPartitionedCall/sequential/sequential/activation_3/Relu (CudaDepthwiseConvolution)
[11/25/2021-09:32:51] [V] [TRT] CudaDepthwiseConvolution has no valid tactics for this config, skipping
[11/25/2021-09:32:51] [V] [TRT] --------------- Timing Runner: StatefulPartitionedCall/sequential/sequential/conv2d_3/BiasAdd + StatefulPartitionedCall/sequential/sequential/activation_3/Relu (CublasConvolution)
[11/25/2021-09:32:51] [V] [TRT] CublasConvolution has no valid tactics for this config, skipping
[11/25/2021-09:32:51] [V] [TRT] >>>>>>>>>>>>>>> Chose Runner Type: CaskConvolution Tactic: -3263369460438823196
[11/25/2021-09:32:51] [V] [TRT] StatefulPartitionedCall/sequential/sequential/conv2d_3/BiasAdd + StatefulPartitionedCall/sequential/sequential/activation_3/Relu (scudnn) Set Tactic Name: volta_scudnn_128x64_sliced1x2_ldg4_relu_exp_large_nhwc_tn_v1
[11/25/2021-09:32:51] [V] [TRT] 
[11/25/2021-09:32:51] [V] [TRT] StatefulPartitionedCall/sequential/sequential/conv2d_3/BiasAdd + StatefulPartitionedCall/sequential/sequential/activation_3/Relu (scudnn) Set Tactic Name: volta_scudnn_128x128_relu_exp_medium_nhwc_tn_v1
